{
    "transactions" : [
        {
            "id" : 1,
            "type" : "ContractCreation",
            "nonce" : 95,
            "value" : 4,
            "receive_address" : "0x9bfa97dd7c7bb1c4b4c8bc5cf0ec41eeaf4d388d",
            "gas_price" : 8,
            "gas" : 45000,
            "data" : "0xb886b9dec50e17307d0a5579d8a315b33e98ece484eac2c6",
            "sender" : "0xca4bd01daa338beccd57f5e4a07557797f7b5e64"
        },
        {
            "id" : 2,
            "type" : "NullTransaction",
            "nonce" : 112,
            "value" : 1,
            "receive_address" : "0xf4ae4a37b33461aa3bf03d169c437a4ca310e968",
            "gas_price" : 14,
            "gas" : 42000,
            "data" : "0xdcfa22cc12f5e3dd7c4af3ca85abb05ec645ddbe8a3193cdb2",
            "sender" : "0x461fb6cb83437a5a2ae3e836fd91a4f9a5f39d4f"
        },
        {
            "id" : 8,
            "type" : "MessageCall",
            "nonce" : 1122,
            "value" : 6,
            "receive_address" : "0x9dd0fe11122b8c1421f334e88ef83b428f422564",
            "gas_price" : 3,
            "gas" : 2000,
            "data" : "0x6fe7ce79dc",
            "sender" : "0x59bfb5a33a46ca115aac1b2d647f9a54ffae21c0"
        }
    ],
    "previous_header" : {
        "parent_hash" : 28,
        "number" : 42,
        "gas_limit" : 500000,
        "gas_used" : 123000,
        "coinbase" : "0x26cc4b51f5b4b5b8bff4342dfc95d560bdbf9705",
        "prevrandao" : 66,
        "chain_id" : 3,
        "basefee" : 3,
        "blob_basefee" : 8,
        "timestamp" : 547675436587
    },
    "current_header" : {
        "parent_hash" : 128,
        "number" : 48,
        "gas_limit" : 500000,
        "gas_used" : 133000,
        "coinbase" : "0x8e7e6a2463079a0ebd8cddabba98a086ceaa5c27",
        "prevrandao" : 36,
        "chain_id" : 3,
        "basefee" : 3,
        "blob_basefee" : 14,
        "timestamp" : 547675436597
    },
    "account_blocks" : [
        {
            "account_address" : "0x5b0dd93b8d866d5d54e4e4b55eb5c620cb9eaf53",
            "transactions" : [1, 2]
        },
        {
            "account_address" : "0xee489f6ccdbe4583c11fa7d76c46694943d8690a",
            "transactions" : [1, 8]
        }
    ],
    "input_messages" : [
        {
            "src" : "0xca4bd01daa338beccd57f5e4a07557797f7b5e64",
            "dst" : "0x9bfa97dd7c7bb1c4b4c8bc5cf0ec41eeaf4d388d",
            "value" : 4,
            "transaction" : 1
        }
    ],
    "output_messages" : [
        {
            "src" : "0x461fb6cb83437a5a2ae3e836fd91a4f9a5f39d4f",
            "dst" : "0xf4ae4a37b33461aa3bf03d169c437a4ca310e968",
            "value" : 1,
            "transaction" : 2
        }
    ]
}
